文献種類	論文タイトル	言語	キーワード	公開日	論文タイトル英語	その他タイトル	著者所属	著者所属英語	著者名	著者名英語	論文抄録	論文抄録英語	研究会名	ファイル名	ファイル公開日	非会員価格	会員価格	ライセンス表記	書誌レコードID	雑誌名	巻	号	表記開始ページ	表記終了ページ	発行年月日	物理ページ開始	物理ページ終了
Symposium	表紙	Ja		1986/01/08										WPRO1986front.pdf	1986/01/08	0	IPSJ:学会員,0|DLIB:会員,0			第27回プログラミング・シンポジウム報告集	1986				1986/01/08	1	1
Symposium	中表紙	Ja		1986/01/08										WPRO1986title.pdf	1986/01/08	0	IPSJ:学会員,0|DLIB:会員,0			第27回プログラミング・シンポジウム報告集	1986				1986/01/08	5	5
Symposium	第27回プログラミング・シンポジウム開催に際して	Ja		1986/01/08					米田,信夫					WPRO1986preface1.pdf	1986/01/08	0	IPSJ:学会員,0|DLIB:会員,0			第27回プログラミング・シンポジウム報告集	1986				1986/01/08	7	7
Symposium	第27回プログラミング・シンポジウムの準備にあたって	Ja		1986/01/08					辻,尚史					WPRO1986preface2.pdf	1986/01/08	0	IPSJ:学会員,0|DLIB:会員,0			第27回プログラミング・シンポジウム報告集	1986				1986/01/08	9	9
Symposium	プログラム	Ja		1986/01/08										WPRO1986program.pdf	1986/01/08	0	IPSJ:学会員,0|DLIB:会員,0			第27回プログラミング・シンポジウム報告集	1986				1986/01/08	10	10
Symposium	目次	Ja		1986/01/08										WPRO1986toc.pdf	1986/01/08	0	IPSJ:学会員,0|DLIB:会員,0			第27回プログラミング・シンポジウム報告集	1986				1986/01/08	11	11
Symposium	OPS5が提供するプログラミング・パラダイムと実行効率について	Ja		1986/01/08			日本アイ・ビー・エム(株) サイエンス・インスティチュート		戸沢,義夫					WPRO1986001.pdf	1986/01/08	0	IPSJ:学会員,0|DLIB:会員,0			第27回プログラミング・シンポジウム報告集	1986		1	12	1986/01/08	13	24
Symposium	論理型言語におけるexplicitな否定知識	Ja		1986/01/08			横浜国立大学・工学部		中川,裕志	Nakagawa,Hirosi				WPRO1986002.pdf	1986/01/08	0	IPSJ:学会員,0|DLIB:会員,0			第27回プログラミング・シンポジウム報告集	1986		13	21	1986/01/08	25	33
Symposium	(And/Or木∪ガード)∩データフロー⊂GHC	Ja		1986/01/08			北海道大学工学部;;北海道大学工学部;;北海道大学工学部		栗原,正仁;;藤村,考;;加地,郁夫	Kurihara,Masahito;;Fujimura,Kou;;Kaji,Ikuo				WPRO1986003.pdf	1986/01/08	0	IPSJ:学会員,0|DLIB:会員,0			第27回プログラミング・シンポジウム報告集	1986		23	33	1986/01/08	35	45
Symposium	ν行為とリーダ・ライタの仕様表現	Ja		1986/01/08			筑波大学工学研究科;;筑波大学電子・情報工学系;;筑波大学電子・情報工学系;;筑波大学電子・情報工学系		水谷,哲也;;辻,尚史;;細野,千春;;五十嵐,滋	Mizutani,Tetsuya;;Tuji,Takashi;;Hosono,Chiharu;;Igarashi,Shigeru				WPRO1986004.pdf	1986/01/08	0	IPSJ:学会員,0|DLIB:会員,0			第27回プログラミング・シンポジウム報告集	1986		35	46	1986/01/08	47	58
Symposium	夏のシンポジウム報告	Ja		1986/01/08			東京大学		和田,英一	Wada,Eiiti				WPRO1986005.pdf	1986/01/08	0	IPSJ:学会員,0|DLIB:会員,0			第27回プログラミング・シンポジウム報告集	1986		47	48	1986/01/08	59	60
Symposium	第18回情報科学若手の会シンポジウム報告	Ja		1986/01/08			神戸大学 自然科学研究科		松田,秀雄	Matsuda,Hideo				WPRO1986006.pdf	1986/01/08	0	IPSJ:学会員,0|DLIB:会員,0			第27回プログラミング・シンポジウム報告集	1986		49	54	1986/01/08	61	66
Symposium	山内賞報告	Ja		1986/01/08					山内記念会					WPRO1986008.pdf	1986/01/08	0	IPSJ:学会員,0|DLIB:会員,0			第27回プログラミング・シンポジウム報告集	1986		55	55	1986/01/08	67	67
Symposium	汝のユーザを知れ ―人間中心のシステム・デザインへ向けて―	Ja		1986/01/08			日本アイ・ビー・エム(株) 大和研究所・人間工学;;日本アイ・ビー・エム(株) 大和研究所・人間工学		高嶋,孝明;;加藤,隆	Takashima,Takaaki;;Kato,Takashi				WPRO1986009.pdf	1986/01/08	0	IPSJ:学会員,0|DLIB:会員,0			第27回プログラミング・シンポジウム報告集	1986		57	62	1986/01/08	69	74
Symposium	演算子文法用汎用構造エディタ	Ja		1986/01/08			(財)新世代コンピュータ技術開発機構;;(財)新世代コンピュータ技術開発機構		佐藤,裕幸;;坂井,公	Sato,Hiroyuki;;Sakai,Kou				WPRO1986010.pdf	1986/01/08	0	IPSJ:学会員,0|DLIB:会員,0			第27回プログラミング・シンポジウム報告集	1986		63	73	1986/01/08	75	85
Symposium	多層テキスト構造を持つ日本語エディタ	Ja		1986/01/08			電気通信大学		角田,博保	Kakuda,Hiroyasu				WPRO1986011.pdf	1986/01/08	0	IPSJ:学会員,0|DLIB:会員,0			第27回プログラミング・シンポジウム報告集	1986		75	84	1986/01/08	87	96
Symposium	unix上で動くASCIIキーボードを使った日本語エディタの作成	Ja		1986/01/08			津田塾大学数学科		小川,貴英	Ogawa,Takahide				WPRO1986012.pdf	1986/01/08	0	IPSJ:学会員,0|DLIB:会員,0			第27回プログラミング・シンポジウム報告集	1986		85	94	1986/01/08	97	106
Symposium	変換型日本語ワープロ向き打鍵レベル模型	Ja		1986/01/08			東京工業大学理学部;;東京工業大学理学部		木村,泉;;粕川,正充					WPRO1986013.pdf	1986/01/08	0	IPSJ:学会員,0|DLIB:会員,0			第27回プログラミング・シンポジウム報告集	1986		95	106	1986/01/08	107	118
Symposium	確率モデルに基づく言語処理へのアプローチ	Ja		1986/01/08			日本アイ・ビー・エム サイエンスインスティチュート		藤崎,哲之助					WPRO1986014.pdf	1986/01/08	0	IPSJ:学会員,0|DLIB:会員,0			第27回プログラミング・シンポジウム報告集	1986		107	119	1986/01/08	119	131
Symposium	招待講演「川柳が来て計算機弱るなり」	Ja		1986/01/08					水谷,静夫					WPRO1986015.pdf	1986/01/08	0	IPSJ:学会員,0|DLIB:会員,0			第27回プログラミング・シンポジウム報告集	1986		121	122	1986/01/08	133	134
Symposium	メインフレーム・コンピュータにおけるCプログラム開発環境	Ja		1986/01/08			東京大学文献情報センター;;東京大学大型計算機センター;;東京大学大型計算機センター;;東京大学大型計算機センター		安達,淳;;木村,友則;;村尾,裕一;;石田,晴久	Adachi,Jun;;Kimura,Tomonori;;Murao,Hirokazu;;Ishida,Haruhisa				WPRO1986016.pdf	1986/01/08	0	IPSJ:学会員,0|DLIB:会員,0			第27回プログラミング・シンポジウム報告集	1986		123	130	1986/01/08	135	142
Symposium	UtilispのMacintoshへの移植。その苦難の道のり	Ja		1986/01/08			東京大学工学部;;東京大学工学部		湯浅,敬;;金子,敬一					WPRO1986017.pdf	1986/01/08	0	IPSJ:学会員,0|DLIB:会員,0			第27回プログラミング・シンポジウム報告集	1986		131	141	1986/01/08	143	153
Symposium	分散システム上の高品質文書処理環境における問題	Ja		1986/01/08			東京工業大学・総合情報処理センター;;東京工業大学・総合情報処理センター		小暮,博道;;村井,純	Kogure,Hiromichi;;Murai,Jun				WPRO1986018.pdf	1986/01/08	0	IPSJ:学会員,0|DLIB:会員,0			第27回プログラミング・シンポジウム報告集	1986		143	152	1986/01/08	155	164
Symposium	コンピュータに「絵」を描かせるには…	Ja		1986/01/08			東京大学・工学部		斎藤,隆文	Saito,Takafumi				WPRO1986019.pdf	1986/01/08	0	IPSJ:学会員,0|DLIB:会員,0			第27回プログラミング・シンポジウム報告集	1986		153	158	1986/01/08	165	170
Symposium	ピアノ演奏のコンピュータ分析とその自動演奏への応用	Ja		1986/01/08			筑波大学理工学研究科;;筑波大学電子・情報系;;筑波大学電子・情報系		小川,亮一;;三好,和憲;;五十嵐,滋	Ogawa,Ryoichi;;Miyoshi,Kazunori;;Igarasi,Shigeru				WPRO1986020.pdf	1986/01/08	0	IPSJ:学会員,0|DLIB:会員,0			第27回プログラミング・シンポジウム報告集	1986		159	168	1986/01/08	171	180
Symposium	ドキュメンテーションエンジニアリングによるマニュアル作成	Ja		1986/01/08			富士通株式会社;;富士通株式会社		根岸,寛明;;吉田,哲三	Negishi,Hiroaki;;Yoshida,Tetsuzou				WPRO1986021.pdf	1986/01/08	0	IPSJ:学会員,0|DLIB:会員,0			第27回プログラミング・シンポジウム報告集	1986		169	180	1986/01/08	181	192
Symposium	情報処理部門の意識改革の試み ―プロトタイピングによるスケジュール管理システムの開発を例に―	Ja		1986/01/08			(財)電力中央研究所・経済研究所・情報システム部;;(財)電力中央研究所・経済研究所・情報システム部;;(財)電力中央研究所・経済研究所・情報システム部;;中国電力株式会社・情報システムセンター;;中国電力株式会社・情報システムセンター		坂内,広蔵;;寺野,隆雄;;高橋,光裕;;佐藤,隆;;宇佐川,雄士	Bannai,Kozo;;Terano,Takao;;Takahashi,Mitsuhiro;;Sato,Takashi;;Usagawa,Yuushi				WPRO1986022.pdf	1986/01/08	0	IPSJ:学会員,0|DLIB:会員,0			第27回プログラミング・シンポジウム報告集	1986		181	190	1986/01/08	193	202
Symposium	国産数式処理システムGALの開発	Ja		1986/01/08			理研;;電総研		佐々木,建昭;;元吉,文男	Sasaki,Tateaki;;Motoyoshi,Fumio				WPRO1986023.pdf	1986/01/08	0	IPSJ:学会員,0|DLIB:会員,0			第27回プログラミング・シンポジウム報告集	1986		191	200	1986/01/08	203	212
Symposium	奥付	Ja		1986/01/08										WPRO1986colophon.pdf	1986/01/08	0	IPSJ:学会員,0|DLIB:会員,0			第27回プログラミング・シンポジウム報告集	1986				1986/01/08	213	213
Symposium	裏表紙	Ja		1986/01/08										WPRO1986back.pdf	1986/01/08	0	IPSJ:学会員,0|DLIB:会員,0			第27回プログラミング・シンポジウム報告集	1986				1986/01/08	218	218